{
  "schemaVersion": 1,
  "id": "v149/css-gap-decorations",
  "route": "/v149/css-gap-decorations/",
  "identity": "5157805733183488",
  "milestone": 149,
  "status": "built",
  "revision": 1,
  "reviewedAt": "2026-07-19",
  "reviewer": "manual-lifecycle-seed",
  "frontendTouched": true,
  "rubric": [
    {
      "dimension": "factual-source-fidelity",
      "score": 5,
      "severity": "info",
      "evidence": "column-rule / row-rule gap-decoration grammar traced to the CSS Gaps spec; identity 5157805733183488 present; a 'live example' section embeds the showcase demo."
    },
    {
      "dimension": "examples",
      "score": 5,
      "severity": "info",
      "evidence": "Has both <pre> recipes and the embedded /v149/css-gap-decorations showcase iframe (example-surface-present + demo-embed-own-feature pass)."
    },
    {
      "dimension": "browser-compat-fallbacks",
      "score": 4,
      "severity": "minor",
      "evidence": "'browser support' section present (browser-support-section pass)."
    },
    {
      "dimension": "responsive-ux",
      "score": 5,
      "severity": "info",
      "evidence": "no-horizontal-overflow desktop+mobile pass; the property grammar <pre> blocks wrap within 360px."
    },
    {
      "dimension": "accessibility",
      "score": 4,
      "severity": "minor",
      "evidence": "main-landmark + single-h1 pass."
    },
    {
      "dimension": "showcase-demo-relationship",
      "score": 5,
      "severity": "info",
      "evidence": "cpsFeature references CPS conformance at /v149/css-gap-decorations/conformance; gendn doesn't fork the demo's platform assertions."
    }
  ],
  "guidanceConsulted": [
    {
      "id": "css-layout",
      "query": "responsive data tables and code blocks without horizontal overflow on mobile",
      "recommendation": "min-width:0 + overflow:auto on code blocks; intrinsic sizing over fixed widths for the recipe grid.",
      "appliedOrException": "Applied/verified — recipe code blocks and the demo iframe stay within the 360px viewport (no-horizontal-overflow-mobile pass)."
    }
  ],
  "openQuestions": [],
  "followUpGoals": [
    {
      "goal": "Add a recipe for gap decorations interacting with subgrid once the showcase demonstrates it.",
      "kind": "additive-page",
      "priority": "low",
      "suggestedSlug": "css-gap-decorations-subgrid"
    }
  ],
  "summary": "A model reference: spec-faithful grammar, live embedded demo, clean matrix. Only an additive subgrid recipe is worth queuing."
}
