{
  "schemaVersion": 1,
  "id": "v148/html-in-canvas",
  "route": "/v148/html-in-canvas/",
  "identity": "5172548013916160",
  "milestone": 148,
  "status": "built",
  "revision": 1,
  "reviewedAt": "2026-07-19",
  "reviewer": "manual-lifecycle-seed",
  "frontendTouched": true,
  "rubric": [
    {
      "dimension": "factual-source-fidelity",
      "score": 4,
      "severity": "minor",
      "evidence": "drawImage-of-an-HTML-element surface described against the canvas spec; chromestatus-identity-link (feature 5172548013916160) passes."
    },
    {
      "dimension": "completeness",
      "score": 3,
      "severity": "minor",
      "evidence": "Has an example surface (example-surface-present: pass) but the 2026-07-19 run flags browser-support-section: FAIL — no support/compat/baseline section or signal is present."
    },
    {
      "dimension": "browser-compat-fallbacks",
      "score": 2,
      "severity": "major",
      "evidence": "browser-support-section assertion returned false: the page states no cross-browser support / Baseline status. A reader can't tell if this is Chrome-only. This is the primary gap.",
      "notes": "Fix in place: add a 'browser support' section from webstatus.dev/BCD (routine Step 6 #7). Do NOT weaken the immutable assertion."
    },
    {
      "dimension": "accessibility",
      "score": 4,
      "severity": "minor",
      "evidence": "Single <main>, single <h1> (pass)."
    },
    {
      "dimension": "responsive-ux",
      "score": 4,
      "severity": "minor",
      "evidence": "no-horizontal-overflow desktop+mobile pass in the 2026-07-19 run."
    }
  ],
  "guidanceConsulted": [
    {
      "id": "css-layout",
      "query": "responsive data tables and code blocks without horizontal overflow on mobile",
      "recommendation": "Use overflow:auto and min-width:0 on code/table containers so narrow viewports scroll the block instead of the page.",
      "appliedOrException": "No layout change needed — overflow assertions already pass; recorded for the pending browser-support-section fix so the new compat table is authored responsively."
    }
  ],
  "openQuestions": [
    "Which browsers ship HTML-in-canvas? Populate a real compat table before marking this dimension resolved."
  ],
  "followUpGoals": [
    {
      "goal": "Add an MDN-style 'browser support' section (Baseline + per-browser) so browser-support-section passes — fix the page, not the assertion.",
      "kind": "targeted-fix",
      "priority": "high"
    }
  ],
  "summary": "Solid example surface, but missing the cross-browser support section the immutable suite requires. Recorded as a high-priority targeted fix; the assertion stays immutable."
}
