{
  "schemaVersion": 1,
  "id": "v155/jpeg-xl-decoding-support-image-jxl-in-blink",
  "route": "/v155/jpeg-xl-decoding-support-image-jxl-in-blink/",
  "identity": "5114042131808256",
  "milestone": 155,
  "status": "built",
  "revision": 1,
  "reviewedAt": "2026-10-11",
  "reviewer": "weekly-hardening writer self-review; independent integrator source review pending",
  "frontendTouched": true,
  "rubric": [
    {
      "dimension": "factual-source-fidelity",
      "score": 5,
      "severity": "info",
      "evidence": "Format capabilities, decoder identity (jxl-rs, memory-safe pure Rust) and platform milestones quoted from the ChromeStatus record; flags (enable-jxl-image-format, Finch JXLImageFormat), TAG review, WPT status including the flag-enabled run with two known failures, and vendor-position quotes all from the fetched Intent to Ship (mail-archive msg17256 + Groups msgid link). Firefox status taken from Firefox's own 153 release notes (Nightly-only, image.jxl.enabled, bug 2040074) rather than the coarser ChromeStatus vendor view, with both shown. An earlier draft's inline base64 'minimal JXL' probe was REMOVED because its bytes could not be traced to any source — the shipped snippet probes a self-served real .jxl instead, mirroring the showcase demo."
    },
    {
      "dimension": "milestone-mapping",
      "score": 5,
      "severity": "info",
      "evidence": "Feature 5114042131808256 confirmed in the milestone=155 listing under 'Enabled by default' with listing name 'JPEG XL decoding support (image/jxl) in blink' (fetched 2026-10-11); slug from the listing name matches the folder and the live showcase route."
    },
    {
      "dimension": "completeness",
      "score": 4,
      "severity": "info",
      "evidence": "Format-support change with no new JS API: inventory is the decode-support change, the <picture>/<source type> negotiation surface, and the script detection pattern, each with nine-dimension mappings. ISO text is paywalled, so format internals are linked (ISO pages, jpegxl.info), not restated — stated explicitly on the page."
    },
    {
      "dimension": "explanation-quality",
      "score": 4,
      "severity": "info",
      "evidence": "Separates what the codec change is (decode-level, no per-surface enumeration in sources), what the format brings (capability table quoting the summary), how to deploy safely (<picture> fall-through per the HTML Standard), and how to detect (probe a real file; Accept-header caveat scoped to sources read)."
    },
    {
      "dimension": "examples",
      "score": 4,
      "severity": "minor",
      "evidence": "Markup example (img + picture fall-through) and two detection snippets (Image onload probe, createImageBitmap diagnosable probe), gendn-derived and labelled, mirroring the probes the embedded decode-probe showcase demo runs against a real 30 KB .jxl. Not executed locally outside the showcase demo."
    },
    {
      "dimension": "browser-compat-fallbacks",
      "score": 4,
      "severity": "minor",
      "evidence": "BCD absence verified by searching the whole 8.1.5 dataset for jxl/jpeg_xl keys (none) and stated; table built from webstatus.dev (Chrome 155 2026-10-06, Safari 17 2023-09-18), ChromeStatus milestones, and Firefox 153 release notes (Nightly-only), with Edge recorded unknown. Deployment advice keeps non-supporting browsers working via <picture>."
    },
    {
      "dimension": "links-validity",
      "score": 4,
      "severity": "minor",
      "evidence": "Every named source directly linked: Groups msgid + mail-archive, both ISO standard pages (labelled paywalled), IANA registry (HEAD-checked 200), HTML Standard source-type anchor, jxl-rs repo, TAG review, Firefox release notes + bug, webstatus.dev, developer-signals issue, chromestatus feature link (invariant #3). ISO page titles could not be independently read (Cloudflare challenge), so the page attributes those links to the records that carry them instead of asserting edition titles."
    },
    {
      "dimension": "accessibility",
      "score": 4,
      "severity": "info",
      "evidence": "Single h1, sequential h2 outline with stable ids, baseline banner role=note with aria-label, iframe title + figcaption, thead/th scope=row tables, alt text present in markup examples; colors are styles.css tokens only."
    },
    {
      "dimension": "responsive-ux",
      "score": 4,
      "severity": "info",
      "evidence": "Same responsive kit as the sibling v155 pages: .table-wrap{overflow-x:auto} wrappers, pre{overflow-x:auto}, overflow-wrap:anywhere on headings/lede/inline code, iframe max-width:100% + loading=lazy with reserved height. Verified via the repo responsive scan (desktop+mobile green) and writer-read screenshots."
    },
    {
      "dimension": "showcase-demo-relationship",
      "score": 5,
      "severity": "info",
      "evidence": "All three CPS concept routes HEAD-checked 200 on 2026-10-11; decode-probe embedded (it IS the page's detection story, run live four ways), format-showdown and picture-fallback linked in the figcaption; feature route in see-also."
    }
  ],
  "guidanceConsulted": [
    {
      "id": "responsive-table",
      "query": "MDN-style reference documentation page responsive compat table baseline banner",
      "recommendation": "Semantic thead/th foundation; wrap tables in an overflow:auto wrapper so wide tables scroll inside the wrapper, not the page.",
      "appliedOrException": "Applied: all four tables use thead or th scope=row inside .table-wrap{overflow-x:auto;max-inline-size:100%}."
    },
    {
      "id": "performance",
      "query": "embed cross-origin iframe demo in article responsive sizing lazy loading",
      "recommendation": "Defer offscreen embeds and avoid layout shift from late-loading media.",
      "appliedOrException": "Applied: showcase iframe uses loading=\"lazy\" with explicit width/height reserving space; sandbox + referrerpolicy pair per the repo's gendn-kjq iframe posture."
    },
    {
      "id": "lazy-load-video-and-audio",
      "query": "embed cross-origin iframe demo in article responsive sizing lazy loading",
      "recommendation": "Defer downloading offscreen media assets until the player approaches the viewport.",
      "appliedOrException": "Applied by analogy to the embedded demo iframe (lazy + reserved box); no audio/video elements on this page."
    }
  ],
  "openQuestions": [
    "Whether Chrome 155 adds image/jxl to the Accept request header is not recorded in the sources read; the page scopes its content-negotiation advice accordingly. Verify against Chromium source or the fetch spec integration when documented.",
    "Which Blink image-consuming surfaces (CSS images, favicon, canvas drawImage sources) are covered is not enumerated by the ChromeStatus record or Intent; the page states the codec-level framing instead of per-surface claims.",
    "No Edge release with JXL is recorded in the sources read.",
    "BCD has no JPEG XL key; the compat table is interim and labelled as such.",
    "The two WPT failures the Intent links (icc-uncommon-profile, cmyk-basic-conversion) were under investigation at intent time; re-check whether they were fixed by ship."
  ],
  "followUpGoals": [
    {
      "goal": "Watch for a BCD or MDN JPEG XL entry (image format pages or an http/image-types key) and replace the interim compat table with quoted BCD data when it lands.",
      "kind": "targeted-fix",
      "priority": "medium"
    },
    {
      "goal": "Determine from Chromium source whether image/jxl was added to the Accept header for image requests, and update the content-negotiation paragraph with a direct citation either way.",
      "kind": "targeted-fix",
      "priority": "medium"
    },
    {
      "goal": "Record the first non-Nightly Firefox release with JXL enabled when Firefox ships it (watch bug 2040074 and later release notes).",
      "kind": "targeted-fix",
      "priority": "low"
    }
  ],
  "summary": "New full reference (Case B) for Chrome 155 JPEG XL decoding. MDN check 2026-10-11: MDN has no dedicated JPEG XL page (only the cross-format image-types guide) and no BCD key exists, so a full gendn page, not a stub."
}
