{
  "schemaVersion": 1,
  "id": "v153/capability-elements-camera-and-microphone",
  "route": "/v153/capability-elements-camera-and-microphone/",
  "identity": "5153829504024576",
  "milestone": 153,
  "status": "built",
  "revision": 1,
  "reviewedAt": "2026-07-28",
  "reviewer": "pi leaf worker (wave 1) \u2014 self-critique against primary sources; independent review still required",
  "frontendTouched": true,
  "rubric": [
    {
      "dimension": "factual-source-fidelity",
      "score": 4,
      "severity": "major",
      "evidence": "Every behavioral claim traces to a linked implementation file fetched 2026-07-28: interface composition from html_camera_element.idl + html_microphone_element.idl + html_media_capture_element_base.idl + two modules/mediastream partials; event dispatch ordering from user_media_request_provider_impl.cc (SetMediaStream/SetError before EnqueueEvent); activation gating and cancel mapping from html_media_capture_element_base.cc; setConstraints contract (first-call-wins via did_set_constraints_, member backfill, bare-scalar SanitizeTrackConstraints with the exact kept-property list) from user_media_element_constraints.cc. Documented divergences instead of smoothing them: spec track/ontrack vs shipping stream/onstream; spec MediaTrackConstraintSet vs shipping HTMLMediaStreamConstraints; the original 2026-07-28 trunk flag/listing mismatch and then-absent camera/mic WPT tests. Both are re-checked on-page for 2026-10-08: trunk stable/public vs M153 branch without status; five files each in upstream camera/ and microphone/ WPT suites. Prose correctness still requires independent review per the contract.",
      "notes": "Deliberately did NOT copy the sibling usermedia page's '<camera>/<microphone> become mute toggles' framing \u2014 the current spec marks that behavior TBD and the shipping provider early-returns on an active stream."
    },
    {
      "dimension": "milestone-mapping",
      "score": 5,
      "severity": "info",
      "evidence": "Feature id 5153829504024576 appears in the live milestone=153 listing under 'Enabled by default' (verified 2026-07-28); slug derived from the listing name per invariant #1; folder placed per invariant #2. The intent's 152 estimate vs the listing's 153 is documented with both sources.",
      "notes": ""
    },
    {
      "dimension": "completeness",
      "score": 4,
      "severity": "major",
      "evidence": "reference-contract.json inventories 9 items (2 elements, 2 properties, 1 method, 1 dictionary, 3 events) \u2014 the complete developer-facing surface derivable from the IDL composition \u2014 mapped to the overview plus three stable child routes (properties/, setconstraints/, events/), each covering all nine dimensions. Claimed implementation-sufficient; structural gates must confirm.",
      "notes": "Substantial members got child routes per the contract rather than a compressed table."
    },
    {
      "dimension": "explanation-quality",
      "score": 4,
      "severity": "info",
      "evidence": "why-they-exist section grounds the feature in the usermedia MVP and PEPC lineage with the single-capability motivation; each section cites its sources inline; the errors table gives exact DOMException names/messages with reachability caveats.",
      "notes": ""
    },
    {
      "dimension": "examples",
      "score": 4,
      "severity": "info",
      "evidence": "Overview example configures and consumes both elements end-to-end (setConstraints + stream/cancel/error handlers + srcObject attach); child pages add focused examples including the first-call-wins and sanitizer pitfalls as corrected anti-patterns.",
      "notes": "No showcase iframe: the CPS route for this feature 404s (2026-07-28); the page says so and links the sibling usermedia demo instead of embedding a broken frame."
    },
    {
      "dimension": "browser-compat-fallbacks",
      "score": 4,
      "severity": "minor",
      "evidence": "Compatibility tables on every page carry explicit unknowns (WebView), the source-dated trunk/M153-branch flag distinction, BCD/MDN absence, and the now-present WPT suites; fallback-content and feature-detection guidance is in context sections and examples.",
      "notes": "WPT discrepancy should be re-checked once the 153 branch promotion tests land."
    },
    {
      "dimension": "links-validity",
      "score": 5,
      "severity": "info",
      "evidence": "All citation labels are direct links to primary artifacts (spec, explainer, intent thread, ChromeStatus feature + API, Chromium IDL/impl files, TAG review, webstatus). The Google-internal tracking bug (b.corp.google.com) is deliberately NOT linked and is noted as internal-only in reference-contract.json notes. Zero plain-text source labels.",
      "notes": ""
    },
    {
      "dimension": "accessibility",
      "score": 5,
      "severity": "info",
      "evidence": "Single h1, single main landmark, sequential h2 outline, tables use caption + th scope=row/col, code in semantic pre/code, baseline banner uses role=note with aria-label.",
      "notes": ""
    },
    {
      "dimension": "responsive-ux",
      "score": 4,
      "severity": "info",
      "evidence": "Wide doc-tables wrapped in .table-wrap{overflow-x:auto}; overflow-wrap:anywhere on h1, cells, and code tokens; h1 uses <wbr> hints on child pages. Headless-Chromium screenshots at 390px and 1280px verified by the writer (see report).",
      "notes": "Integrator re-runs the formal responsive matrix."
    },
    {
      "dimension": "showcase-demo-relationship",
      "score": 4,
      "severity": "info",
      "evidence": "No CPS demo exists for this feature (route 404, 2026-07-28) \u2014 page states this honestly and cross-links the sibling usermedia demo which exercises the same mechanism.",
      "notes": ""
    }
  ],
  "guidanceConsulted": [
    {
      "id": "accessibility",
      "query": "MDN-style API reference documentation page responsive tables code examples accessibility",
      "recommendation": "Place all content within landmarks; sequential h1-h6 outline; semantic tables with caption and th scope; lists for repeated content.",
      "appliedOrException": "Applied: single main landmark, one h1, sequential h2s, caption + th scope on every doc-table, ul/ol for enumerations.",
      "evidence": "Page markup; headless screenshots /tmp/capability-elements-camera-and-microphone-{mobile,desktop}.png"
    },
    {
      "id": "css-layout",
      "query": "responsive data table horizontal overflow long code tokens mobile reference page",
      "recommendation": "Give long unbreakable content shrink/wrap behavior (min-inline-size:0, overflow-wrap) and scrollable containment rather than letting it force page overflow.",
      "appliedOrException": "Applied: .table-wrap{overflow-x:auto} around every wide table; overflow-wrap:anywhere on table cells, code tokens, h1, and the lede.",
      "evidence": "Inline styles per page; headless screenshots /tmp/capability-elements-camera-and-microphone-{mobile,desktop}.png"
    }
  ],
  "openQuestions": [
    "2026-10-08 re-check: trunk CameraAndMicrophoneElements is stable/public, M153 branch-heads/7978 still has no status. How the historical M153 build was enabled is not established by those two snapshots; feature-detect in the target build.",
    "2026-10-08 re-check: WPT camera/ and microphone/ each have five upstream files. Presence is verified; passing results for a particular M153 build remain unverified.",
    "Android WebView availability is unspecified (intent answers 'No' to all-six-platforms) \u2014 confirm the excluded platform set."
  ],
  "followUpGoals": [
    {
      "goal": "Embed the chrome-platform-showcase demo for this feature when the CPS route exists (currently 404) and add a cpsFeature reference.",
      "kind": "targeted-fix",
      "priority": "low"
    },
    {
      "goal": "Audit sibling capability-element pages (v151/capability-elements-usermedia-mvp and family) for the table column-crush bug fixed here (overflow-wrap:anywhere reduces table min-content so auto layout crushes columns at mobile width); hoist the .table-wrap .doc-table{min-width;table-layout:fixed} fix if affected.",
      "kind": "targeted-fix",
      "priority": "medium"
    }
  ]
}
