{
  "schemaVersion": 1,
  "id": "v151/wheel-event-momentum",
  "route": "/v151/wheel-event-momentum/",
  "identity": "6631012282007552",
  "milestone": 151,
  "status": "built",
  "revision": 4,
  "reviewedAt": "2026-07-26",
  "reviewer": "kimi-k3-manual-iteration",
  "frontendTouched": true,
  "rubric": [
    {
      "dimension": "factual-source-fidelity",
      "score": 5,
      "severity": "info",
      "evidence": "Every claim traces to a primary source fetched live on 2026-07-26: the Pointer Events Editor's Draft carries the merged normative text (attribute definition verbatim: true iff synthesized by the platform to simulate scroll inertia after the user ended the physical scroll interaction; un-initialized MUST be false; WheelEventInit momentum = false). Runtime feature WheelEventMomentum is stable at trunk (crbug.com/40704952). Listing status (Enabled by default), detail status (Proposed, desktop+Android 151), and BCD support (chrome 151/mirrors/ff-safari false) are kept separate. The ChromeStatus spec_link's #dom-wheelevent-momentum anchor does not resolve in the current draft \u2014 documented rather than papered over."
    },
    {
      "dimension": "milestone-mapping",
      "score": 5,
      "severity": "info",
      "evidence": "Feature id 6631012282007552 appears in the v151 milestone listing under 'Enabled by default'; route slug derives from the listing name per the documented slug rule; H1 is the listing name verbatim."
    },
    {
      "dimension": "completeness",
      "score": 5,
      "severity": "info",
      "evidence": "Exact surface inventory: one attribute (WheelEvent.momentum) and one dictionary member (WheelEventInit.momentum) \u2014 verified against the spec's WheelEvent IDL, no further members. Overview links the stable member page (momentum/), which covers all nine dimensions for both items plus a dedicated #init section for the dictionary member. reference-contract.json maps 7 sources, 2 inventory items, 18 dimension coverages; deliberately partial pending independent review."
    },
    {
      "dimension": "explanation-quality",
      "score": 5,
      "severity": "info",
      "evidence": "The overview motivates the feature from the developer problem (inertia events indistinguishable from physical input; heuristic workarounds) and states the two-valued semantics precisely, including the script-constructed-event default. The member page documents the false-does-not-prove-physical trap with the correct feature-detection pattern."
    },
    {
      "dimension": "examples",
      "score": 5,
      "severity": "info",
      "evidence": "Overview embeds the identity-verified showcase momentum-tracker (200, same chromestatus id) with a linked source label; snippets show the physical-vs-inertia branch and the constructor init, both from the documented contract."
    },
    {
      "dimension": "browser-compat-fallbacks",
      "score": 5,
      "severity": "info",
      "evidence": "Real BCD-backed table (api/WheelEvent.json: chrome 151, edge mirror, chrome_android/webview mirrors, firefox/safari false, Deno/Node explicitly unknown) with each fact linked. Vendor signals cite the ChromeStatus API record (FF Positive / Safari No signal / web-devs Positive) and are kept separate from BCD rows. Absent WPT coverage is recorded honestly."
    },
    {
      "dimension": "links-validity",
      "score": 5,
      "severity": "info",
      "evidence": "Direct primary-source link contract: the resolvable spec section (#interface-wheelevent), runtime_enabled_features.json5, crbug, BCD file, ChromeStatus page + API record, CodePen sample, MDN general WheelEvent (labelled as not covering momentum), and both showcase routes \u2014 each named source separately linked, target=_blank rel=noopener, zero plain-text labels."
    },
    {
      "dimension": "accessibility",
      "score": 5,
      "severity": "info",
      "evidence": "Single main and h1 per page; sequential h1\u2192h2; tables with captions and scoped headers; banner role=note with aria-label; descriptive iframe title."
    },
    {
      "dimension": "responsive-ux",
      "score": 5,
      "severity": "info",
      "evidence": "First-column width hints and compat-table column min-widths applied from the start (cycle-8/9 lessons); MCP matrix at 1280x800 and 390x844 verifies no document overflow on both routes; pre blocks scroll internally by design."
    },
    {
      "dimension": "showcase-demo-relationship",
      "score": 5,
      "severity": "info",
      "evidence": "Iframe src is the feature's own stable showcase route (momentum-tracker), identity-matched to chromestatus id 6631012282007552 and HEAD-verified 200 alongside the feature-detect sibling (linked in See also). cpsFeature.conformanceRoute is the feature-level route (verified 200). No repointing, no forked platform assertions."
    }
  ],
  "guidanceConsulted": [
    {
      "id": "performance",
      "query": "HTTP protocol header reference page with request response examples and timing attribute reference responsive tables",
      "recommendation": "Keep measurement and event-handling guidance aligned with what the platform actually exposes.",
      "appliedOrException": "Applied: the examples avoid implying the attribute exists everywhere (feature-detect pattern documented) and avoid speculative velocity heuristics."
    },
    {
      "id": "html",
      "query": "readable API reference documentation page with method syntax IDL code blocks and live embedded demo iframe responsive on mobile",
      "recommendation": "Correct HTML semantics for code, figures, and tables; escape examples properly.",
      "appliedOrException": "Applied: figure/figcaption embed, pre/code blocks, th scope attributes, escaped snippets."
    },
    {
      "id": "accessibility",
      "query": "readable API reference documentation page with method syntax IDL code blocks and live embedded demo iframe responsive on mobile",
      "recommendation": "Semantic structure and descriptive titles for embedded frames.",
      "appliedOrException": "Applied across both pages."
    },
    {
      "id": "size-aware-styling",
      "query": "responsive data tables compatibility table readable at 390px without horizontal page overflow",
      "recommendation": "Contain wide content within its track; avoid min-content blowout on narrow viewports.",
      "appliedOrException": "Applied: .table-wrap containment, overflow-wrap anywhere, column min-widths."
    }
  ],
  "openQuestions": [
    "Rev 4 (re-review of 43f03c0): WPT absence claim corrected \u2014 the pinned tree holds exactly two momentum declarations (interfaces/pointerevents.idl lines 90/98, the WebIDL surface itself; prior 'zero hits' wording was wrong) and no behavioral .html/.js test was found; the pinned blob source is linked and mapped. init-errors now documents the getter/Proxy retrieval exception path (ordinary-value conversion remains non-throwing). Explicit momentum: undefined semantics documented (declared default false applies). Residual touchscreen generalization removed; false now means exactly 'otherwise' and is not equated with physical input (uninstrumented platforms and script events also read false).",
    "Resolved upstream: the CPS demo's dead spec-anchor link was fixed by the parent in chrome-platform-showcase 51ad64e6 (all feature/concept/conformance links now use the live #interface-wheelevent anchor, validated desktop/mobile). Verified live 2026-07-26 \u2014 the momentum-tracker references section now links the resolvable anchor.",
    "Rev 2 reflects independent review of dc595df: cpsFeature route fixed to feature-level; runtime claims bounded by Chromium evidence (momentum_phase != kPhaseNone mapping, phase-injection unit test, CL 7869775's Linux manual-test caveat \u2014 hardware/OS coverage needs 151+ hardware evidence, touchscreen generalization removed); authored-vs-native separated via isTrusted; WheelEventInit.momentum reclassified as a dictionary FIELD with exact WebIDL semantics (default false, ToBoolean conversion \u2014 string 'false' is truthy, omitted/unknown handling) and dedicated outputs/errors/security sections; privacy framing now sourced uncertainty (review Pending); both dead spec anchors documented (ChromeStatus + BCD); pointerevents PR #643 + issue #646 + WebIDL/DOM sources added.",
    "Local Chrome is 150 and the feature ships at 151: the runtime contract (momentum true on platform-synthesized inertia events after a fling) is documented from merged spec text but could not be executed locally. Re-verify on a Chrome 151+ build with a real trackpad fling.",
    "The ChromeStatus spec_link anchor #dom-wheelevent-momentum does not resolve in the current draft; if the spec gains a dedicated attribute anchor, deep-link it.",
    "No WPT coverage for momentum as of 2026-07-26; when tests land, cite them from the member page and contract."
  ],
  "followUpGoals": [
    {
      "goal": "When a Chrome 151+ build is available, verify the runtime contract on real hardware (fling on a trackpad: inertia events report momentum=true, physical events false) and record the evidence.",
      "kind": "targeted-fix",
      "priority": "medium"
    },
    {
      "goal": "When WPT gains momentum coverage or the spec gains a dedicated attribute anchor, update the member page citations and the contract sources.",
      "kind": "targeted-fix",
      "priority": "low"
    }
  ]
}
