{
  "schemaVersion": 1,
  "id": "v152/deprecate-and-remove-xslt",
  "route": "/v152/deprecate-and-remove-xslt/",
  "identity": "4709671889534976",
  "milestone": 152,
  "status": "built",
  "revision": 1,
  "reviewedAt": "2026-07-29",
  "reviewer": "writer self-review; independent integrator review pending",
  "frontendTouched": true,
  "rubric": [
    {
      "dimension": "factual-source-fidelity",
      "score": 5,
      "severity": "info",
      "evidence": "Every load-bearing claim traces to a source fetched live on 2026-07-29: dev-doc timeline verbatim (M142-M176 with dates), ChromeStatus OT stage (deprecation trial 'XSLT' 152-175, third-party+insecure, id 1902207892610613249), WHATWG DOM section 9.1 IDL verbatim, Chromium xslt_processor.idl verbatim (RuntimeEnabled=XSLT gating, nullable returns), runtime flag record (origin_trial_type deprecation), about_flags.cc flag wiring, polyfill README limitations, both intent threads, WHATWG issue comments quoted verbatim.",
      "notes": "The M145-vs-M148 pre-stable discrepancy and the original M155/M164 plan (superseded) are disclosed on-page rather than silently picked."
    },
    {
      "dimension": "milestone-mapping",
      "score": 5,
      "severity": "info",
      "evidence": "Folder v152/deprecate-and-remove-xslt matches the slugified listing name; the feature appears in the milestone=152 listing under both 'Stepped rollout' and 'Origin trial' (verified 2026-07-29); the task brief said category 'Browser Intervention' which does not match the live listing — the listing won per invariant #2, and the page's eyebrow uses the real listing categories."
    },
    {
      "dimension": "completeness",
      "score": 5,
      "severity": "info",
      "evidence": "7 inventory items x 9 dimensions in reference-contract.json: both removed surfaces (JS API, PI) plus the five operational contracts a developer needs (timeline, deprecation trial, enterprise policy, migration paths, detection). not-applicable entries carry sourced rationales; syntax/examples/compatibility are documented for every item."
    },
    {
      "dimension": "explanation-quality",
      "score": 5,
      "severity": "info",
      "evidence": "Removal-first framing: what is removed vs kept (CSS PI, XML parsing, XPath) is a dedicated table; the Chromium-vs-WHATWG IDL divergence (null-vs-throw, parameter types) is called out as a migration hazard; vendor positions are quoted with the nuance (WebKit 'cautiously supportive') rather than the record's coarse labels."
    },
    {
      "dimension": "examples",
      "score": 4,
      "severity": "minor",
      "evidence": "Working snippets for feature detection, ReportingObserver, polyfill XSLTProcessor usage, one-line PI migration, OT token serving, and enterprise policy deployment. Runtime behavior not executed locally (no Chrome 152+ binary); snippets trace to the polyfill README and dev-doc verbatim.",
      "notes": "The deployment snippet used standard Chromium policy mechanisms at initial review. Resolution 2026-10-08: policy id 1429 schema/default/platforms are statically verified from chromeenterprise.google/static/json/policy_templates_en-US.json and documented on the deprecation-trial page; original assessment score preserved."
    },
    {
      "dimension": "browser-compat-fallbacks",
      "score": 5,
      "severity": "info",
      "evidence": "BCD api.XSLTProcessor fetched (Chrome 1/Edge 12/Firefox 1/Safari 3.1, deprecated not yet recorded — disclosed). Interim tables are labelled interim; Firefox/Safari removal plans stated as 'planned, no dated plan on the record' rather than invented dates."
    },
    {
      "dimension": "links-validity",
      "score": 4,
      "severity": "minor",
      "evidence": "All citation labels are direct links (invariant: zero plain-text citations). Primary sources fetched live. chromeenterprise.google/policies/#XSLTEnabled is JS-rendered (anchor verified as the dev-doc's own link target; content not statically readable).",
      "notes": "Integrator should run a link sweep."
    },
    {
      "dimension": "accessibility",
      "score": 5,
      "severity": "info",
      "evidence": "Single h1 per page, ordered h2/h3, scope=row table headers, banner role=note with aria-label, descriptive iframe title, CSS variables only (WCAG AA per invariant #5)."
    },
    {
      "dimension": "responsive-ux",
      "score": 4,
      "severity": "minor",
      "evidence": "Long tokens (PI grammar, flag names, URLs) carry overflow-wrap:anywhere; tables in .table-wrap; pre blocks scroll internally; h1 wraps. Screenshots at 390px and 1280px pending final browser check (this critique written before the screenshot pass; will re-shoot if defects appear).",
      "notes": "To be confirmed by the integrator's matrix run."
    },
    {
      "dimension": "showcase-demo-relationship",
      "score": 5,
      "severity": "info",
      "evidence": "CPS feature index + all 4 concept routes (xslt-removal, jsonfeed-rss, xslt-polyfill-explorer, opml-importer) HEAD-checked 200 on 2026-07-29; xslt-removal embedded as the live iframe, the other three linked from the figcaption."
    }
  ],
  "guidanceConsulted": [
    {
      "id": "css-layout",
      "query": "accessible documentation page semantic headings tables overflow-wrap long code tokens",
      "recommendation": "Lean on intrinsic sizing and the browser's layout engine; avoid hardcoded dimensions; keep content-first flow with overflow containment for wide artifacts.",
      "appliedOrException": "Applied: tables use fluid width with .table-wrap overflow-x containment; pre blocks scroll internally; no fixed widths beyond the existing doc-table conventions.",
      "evidence": "Retrieved guide text via npx modern-web-guidance@latest retrieve css-layout on 2026-07-29."
    },
    {
      "id": "accessibility",
      "query": "accessible documentation page semantic headings tables overflow-wrap long code tokens",
      "recommendation": "Semantic structure (single h1, ordered headings, labelled tables) and descriptive titles for embedded frames.",
      "appliedOrException": "Applied: one h1 per page, h2 section order preserved, scope=row headers, role=note banner, iframe title describes the demo content.",
      "evidence": "Search hit retrieved 2026-07-29; applied throughout the four routes."
    }
  ],
  "openQuestions": [
    "Policy-vs-trial precedence when both XSLTEnabled and a deprecation-trial token are present is not specified in any fetched source.",
    "Trial token-failure behavior (expired/wrong-origin token) is handled by generic origin-trial machinery; no XSLT-specific error surface is defined by the sources.",
    "The machine-readable enterprise policy definition (https://chromeenterprise.google/static/json/policy_templates_en-US.json, id 1429) was fetched 2026-10-08: Boolean default null, true/false/unset states, Chrome/ChromeOS/Android/WebView from 146, dynamic refresh and per-profile. Its description still says removal in M164, while the current Chrome removal guide says M176; the child policy table exposes both without silently resolving the contradiction.",
    "2026-10-08 M145-vs-M148 re-check: the developer guide still says M145 Canary and the ChromeStatus experiment plan still says M148 Canary. Chromium milestone schedules show M145/M148 branch and Stable dates but do not establish the pre-stable special-trial activation in either historical build. Retain the page's attributed dual claim pending verified channel rollout evidence; no single milestone can be established safely from these sources.",
    "Firefox and WebKit removal dates are unannounced; the standards issue says they plan to remove, with WebKit waiting for one engine to go first."
  ],
  "followUpGoals": [
    {
      "goal": "When BCD records the XSLT deprecation (api.XSLTProcessor status.deprecated and compat notes), replace the interim compat-table framing with BCD-anchored rows.",
      "kind": "targeted-fix",
      "priority": "medium"
    },
    {
      "goal": "Verify the M145-vs-M148 pre-stable disabling discrepancy against the actual Chrome release schedule once M148 ships, and collapse the honest dual claim to the correct milestone.",
      "kind": "targeted-fix",
      "priority": "low"
    },
    {
      "goal": "Add a dedicated SaxonJS migration child route (API shape, XSLT 1.0 stylesheet compatibility notes) if the removal drives significant SaxonJS adoption questions.",
      "kind": "additive-page",
      "priority": "low"
    }
  ]
}
